{
  "$schema": "http://json-schema.org/draft-07/schema#",
  "$id": "ideas/v1",
  "description": "AI pitch cards over the top-N ranked tickers. Written by .claude/commands/ideas.md via scripts/apply-ideas.mjs. Consumed by /ideas. Each entry is a short investable thesis grounded in the KPI shard + reactions + trend + latest summary — no analyst speculation, no macro narrative, no forward guidance beyond what management already stated.",
  "type": "object",
  "additionalProperties": false,
  "required": ["schema", "generatedAt", "universe", "disclaimer", "pitches"],
  "properties": {
    "schema": { "const": "ideas/v1" },
    "generatedAt": {
      "type": "string",
      "format": "date-time",
      "description": "ISO-8601 timestamp when the AI run wrote this file."
    },
    "universe": {
      "type": "string",
      "description": "Ticker universe scanned (mirrors ranking.json's 'universe' field)."
    },
    "disclaimer": {
      "type": "string",
      "description": "Mandatory user-visible disclaimer. Rendered under the pitch cards on /ideas. Default: 'AI research over the covered universe — not advice, not a recommendation. Cross-check every claim in the primary source before acting.'"
    },
    "pitches": {
      "type": "array",
      "minItems": 1,
      "maxItems": 20,
      "items": {
        "type": "object",
        "additionalProperties": false,
        "required": [
          "ticker",
          "rank",
          "compositeScore",
          "thesis",
          "rationale",
          "risks",
          "catalyst",
          "sources"
        ],
        "properties": {
          "ticker": {
            "type": "string",
            "pattern": "^[A-Z0-9./-]+ [A-Z]{2}$",
            "description": "Bloomberg-style canonical (matches ranking.rows[].ticker)."
          },
          "rank": {
            "type": "integer",
            "minimum": 1,
            "description": "Rank in the current ranking snapshot (used to link back)."
          },
          "compositeScore": {
            "type": "number",
            "minimum": -1,
            "maximum": 1
          },
          "thesis": {
            "type": "string",
            "minLength": 8,
            "maxLength": 160,
            "description": "One-line thesis. ≤ 20 words. Plain English. No hype adjectives."
          },
          "rationale": {
            "type": "string",
            "minLength": 60,
            "maxLength": 800,
            "description": "3-5 sentence rationale grounded in the ticker's ranking components + latest summary. Cites at least one specific KPI or reaction number from the loaded data. NO forward-looking speculation beyond management guidance the summary already captures."
          },
          "risks": {
            "type": "array",
            "minItems": 1,
            "maxItems": 4,
            "items": {
              "type": "string",
              "minLength": 8,
              "maxLength": 200,
              "description": "Concrete risk factor. Cite a real number or a real event (not 'macro uncertainty')."
            }
          },
          "catalyst": {
            "type": "object",
            "additionalProperties": false,
            "required": ["label"],
            "properties": {
              "label": {
                "type": "string",
                "minLength": 4,
                "maxLength": 120,
                "description": "Upcoming event the pitch pivots on (e.g. 'FY2026 Q3 earnings · Oct 29')."
              },
              "date": {
                "type": "string",
                "format": "date",
                "description": "ISO date when known — usually nextScheduled from the events-index."
              }
            }
          },
          "sources": {
            "type": "array",
            "minItems": 1,
            "items": {
              "type": "object",
              "additionalProperties": false,
              "required": ["kind", "ref"],
              "properties": {
                "kind": {
                  "type": "string",
                  "enum": ["summary", "shard", "ranking", "filing", "release"]
                },
                "ref": {
                  "type": "string",
                  "description": "For 'summary' + 'shard' + 'ranking': the identifier ticker+period or 'ranking.json'. For 'filing' + 'release': a direct URL."
                }
              }
            }
          }
        }
      }
    }
  }
}
