{
  "schema": "ideas/v1",
  "generatedAt": "2026-08-19T15:00:00.000Z",
  "universe": "sp500∪r1000∪isCore-operating",
  "disclaimer": "AI research over the covered universe — not advice, not a recommendation. Cross-check every claim in the primary source before acting.",
  "pitches": [
    {
      "ticker": "PLTR US",
      "rank": 1,
      "compositeScore": 0.9998,
      "thesis": "Q2 revenue up 92.8% y/y drove a +22.65% excess 3-day reaction, and FY guidance was raised again.",
      "rationale": "Palantir's Q2 revenue hit $1,935.5M (+92.8% y/y), and the stock's 3-day reaction was +22.65% excess to SPX — one of the sharpest post-earnings moves in the covered universe. Management raised FY2026 revenue guidance to $8.150-8.158B and lifted the U.S. commercial revenue floor to \"in excess of $3.424 billion\" (134%+ y/y growth), alongside a raised FY adjusted free cash flow range of $4.5-4.7B. Q3 guidance was also initiated at $2.160-2.164B revenue.",
      "risks": [
        "Cash fell 11.4% q/q to $2,030.0M after $3.505B of marketable-securities purchases in the quarter — a liquidity-mix shift not explained in the release.",
        "Management's headline $9.2B cash-plus-Treasuries figure doesn't reconcile with balance-sheet cash ($2.030B) plus marketable securities ($7.379B) = $9.409B, a roughly $200M unexplained gap."
      ],
      "catalyst": {
        "label": "FY2026 Q3 earnings",
        "date": "2026-11-02"
      },
      "sources": [
        {
          "kind": "summary",
          "ref": "PLTR US FY2026 Q2"
        },
        {
          "kind": "shard",
          "ref": "PLTR_US.json"
        },
        {
          "kind": "ranking",
          "ref": "ranking.json"
        }
      ]
    },
    {
      "ticker": "APA US",
      "rank": 2,
      "compositeScore": 0.9985,
      "thesis": "EPS beat on higher realized oil pricing drove a +17.97% excess 3-day move even as revenue missed consensus.",
      "rationale": "APA's Q2 diluted EPS of $2.11 beat the $1.87 consensus estimate (+12.77%), and the stock's 3-day reaction was +17.97% excess to SPX. Revenue of $2,373M came in below the $2,428M estimate, so the beat was price- not volume-driven: realized oil price rose 50% y/y to $98.24/bbl while oil volumes fell 10% y/y. Management raised FY U.S. oil production guidance to 123,000 b/d and lifted the 2026 cost-savings target to $500M from $450M.",
      "risks": [
        "Net debt remains $3.3B despite $673M of bond repayment in the quarter.",
        "The EPS beat leaned on a 50% y/y realized-price gain rather than production growth — a reversal in oil prices would remove the driver behind the quarter's strength."
      ],
      "catalyst": {
        "label": "FY2026 Q3 earnings",
        "date": "2026-11-04"
      },
      "sources": [
        {
          "kind": "summary",
          "ref": "APA US FY2026 Q2"
        },
        {
          "kind": "shard",
          "ref": "APA_US.json"
        },
        {
          "kind": "ranking",
          "ref": "ranking.json"
        }
      ]
    },
    {
      "ticker": "ABNB US",
      "rank": 3,
      "compositeScore": 0.9979,
      "thesis": "Revenue and EPS both beat, margins expanded, and the trend signal points to continued double-digit growth.",
      "rationale": "Airbnb's Q2 revenue of $3,608M beat the $3,575.6M consensus by 0.91%, and EPS of $1.37 beat $1.24886 by 9.70%. The stock's 3-day reaction was +21.75% excess to SPX, and the ranking's trend component shows +31.15% on next-quarter revenue estimate versus this quarter's actual. Adjusted EBITDA rose 21% y/y to $1.261B (35% margin, +1pt y/y), and Q3 revenue is guided to $4.69-4.77B (15-17% y/y growth).",
      "risks": [
        "Net income was boosted by a one-time $77M tax benefit tied to newly published prior-year tax guidance, inflating the +27.1% y/y net income growth figure.",
        "Total cash fell 7.8% y/y to $6.821B while short-term investments rose $1.294B, a liquidity mix shift alongside continued Reserve Now, Pay Later expansion."
      ],
      "catalyst": {
        "label": "FY2026 Q3 earnings",
        "date": "2026-11-06"
      },
      "sources": [
        {
          "kind": "summary",
          "ref": "ABNB US FY2026 Q2"
        },
        {
          "kind": "shard",
          "ref": "ABNB_US.json"
        },
        {
          "kind": "ranking",
          "ref": "ranking.json"
        }
      ]
    },
    {
      "ticker": "RIVN US",
      "rank": 4,
      "compositeScore": 0.9961,
      "thesis": "Delivery guidance raised to 65-70k units and EBITDA loss narrowed, though the 3-day pop reversed within a week.",
      "rationale": "Rivian's Q2 diluted EPS of -$0.63 beat the -$0.77637 consensus by 18.85%, and the 3-day reaction was +15.57% excess to SPX. Management raised FY2026 delivery guidance to 65,000-70,000 units (from 12,194 delivered in Q2) and narrowed the FY adjusted-EBITDA loss outlook to -$1.8B to -$2.0B while cutting capex guidance to $1.7-1.8B. Notably, the d1 (-0.76%) and w1 (-3.75%) excess returns show the initial pop faded, leaving only the 3-day window positive.",
      "risks": [
        "Net loss widened to -$833M q/q because Q1 FY2026 had booked a one-off $506M gain on the Mind Robotics deconsolidation that didn't recur.",
        "A July 2026 offering (75M shares plus 11.25M over-allotment at $15.50/share, ~$1,317M net proceeds) isn't yet reflected in the Q2-end balance sheet — undisclosed dilution ahead."
      ],
      "catalyst": {
        "label": "FY2026 Q3 earnings",
        "date": "2026-09-29"
      },
      "sources": [
        {
          "kind": "summary",
          "ref": "RIVN US FY2026 Q2"
        },
        {
          "kind": "shard",
          "ref": "RIVN_US.json"
        },
        {
          "kind": "ranking",
          "ref": "ranking.json"
        }
      ]
    },
    {
      "ticker": "MSTR US",
      "rank": 5,
      "compositeScore": 0.9958,
      "thesis": "Stock rallied +15.41% excess despite a GAAP loss, as the market focused on bitcoin-per-share growth, not EPS.",
      "rationale": "MicroStrategy posted a GAAP net loss of $8,219.6M (-$24.45 diluted EPS) driven by an $8.32B unrealized bitcoin fair-value markdown, yet the stock's 3-day reaction was +15.41% excess to SPX. The market appears to be pricing bitcoin-per-share (+5% q/q) and USD Reserve (+12% q/q to $2.4B) over GAAP earnings. Convertible debt fell 18% q/q to $6.71B after repurchasing $1.50B face value of notes at an 8% discount, and bitcoin holdings grew 11% q/q to 846,000 BTC.",
      "risks": [
        "Cash fell 22.4% q/q to $1.71B after the $1.38B note-repurchase outlay, while share count rose 5.6% q/q on $2.95B of ATM equity issuance — ongoing dilution.",
        "Shareholders' equity fell 34.9% y/y to $30.89B and accumulated deficit swung to $15.20B, both driven by the bitcoin markdown — earnings remain fully hostage to BTC price swings."
      ],
      "catalyst": {
        "label": "FY2026 Q3 earnings",
        "date": "2026-10-29"
      },
      "sources": [
        {
          "kind": "summary",
          "ref": "MSTR US FY2026 Q2"
        },
        {
          "kind": "shard",
          "ref": "MSTR_US.json"
        },
        {
          "kind": "ranking",
          "ref": "ranking.json"
        }
      ]
    },
    {
      "ticker": "RDDT US",
      "rank": 6,
      "compositeScore": 0.9954,
      "thesis": "Eighth straight quarter of 60%+ revenue growth, with international revenue growing faster than the U.S.",
      "rationale": "Reddit's Q2 revenue grew 61.1% y/y to $804.9M — the eighth consecutive quarter above 60% growth — and the stock's 3-day reaction was +15.21% excess to SPX. International revenue grew 84% y/y versus 56% y/y domestically, DAUq rose 18% to 130.3M, and ARPU rose 36% to $6.18. Management guided Q3 revenue to $860-870M (47-49% y/y) and Adjusted EBITDA to $385-395M (63-67% y/y).",
      "risks": [
        "Operating cash flow fell 16.1% q/q to $262M despite higher net income, a sequential decline the filing doesn't decompose.",
        "Cost of revenue rose 53.2% y/y ($70M) on higher hosting usage, only partly offset by hosting-price efficiencies — a cost line growing faster than the 50bp gross-margin gain."
      ],
      "catalyst": {
        "label": "FY2026 Q3 earnings",
        "date": "2026-10-29"
      },
      "sources": [
        {
          "kind": "summary",
          "ref": "RDDT US FY2026 Q2"
        },
        {
          "kind": "shard",
          "ref": "RDDT_US.json"
        },
        {
          "kind": "ranking",
          "ref": "ranking.json"
        }
      ]
    },
    {
      "ticker": "MAN US",
      "rank": 7,
      "compositeScore": 0.9903,
      "thesis": "Revenue re-accelerated to +7.5% y/y and the 1-month excess reaction ran to +54.45%, the largest in the top 12.",
      "rationale": "ManpowerGroup's Q2 revenue grew 7.5% y/y (6% constant-currency) to $4,860.2M, and while the 3-day reaction was +13.32% excess to SPX, the 1-month excess reaction reached +54.45% — the largest sustained move among the top-ranked names. Management issued first-time Q3 EPS guidance of $0.96-1.06, including a roughly 2-cent unfavorable FX impact and a 44% effective tax rate.",
      "risks": [
        "Gross profit rose only 2.2% y/y versus 7.5% revenue growth because cost of services grew faster at 8.6% y/y — a margin-compression signal not itemized by mix or pricing.",
        "Cash fell 19.7% q/q to $180.6M after $585.8M of long-term debt repayment, while short-term debt rose $363.8M q/q to $476.2M."
      ],
      "catalyst": {
        "label": "FY2026 Q3 earnings",
        "date": "2026-10-15"
      },
      "sources": [
        {
          "kind": "summary",
          "ref": "MAN US FY2026 Q2"
        },
        {
          "kind": "shard",
          "ref": "MAN_US.json"
        },
        {
          "kind": "ranking",
          "ref": "ranking.json"
        }
      ]
    },
    {
      "ticker": "FSLR US",